{
  "$schema": "../manifest.schema.json",
  "manifest_version": 1,
  "protocol_version": 1,
  "id": "clipboard",
  "name": "File clipboard",
  "description": "Copy files in your file manager and paste them on another device. Text and images are synchronised by the daemon itself and need no plugin; only file selections require this helper, because reading them needs a desktop toolkit the background service cannot load.",
  "version": "0.11.0",
  "author": "Syntra contributors",
  "homepage": "https://github.com/DarkPhilosophy/syntra",
  "source": "https://github.com/DarkPhilosophy/syntra/tree/main/plugins/clipboard",
  "update_url": "https://github.com/DarkPhilosophy/syntra/releases",
  "license": "GPL-3.0-or-later",
  "bundled": true,
  "executable": "syntra-plugin-clipboard",
  "handshake_ids": ["gtk-clipboard"],
  "capabilities": {
    "clipboard_read": true,
    "paste": true,
    "cancel": true,
    "mime_types": ["text/uri-list", "x-special/gnome-copied-files"],
    "requires_live_mount": true
  }
}
